{
  "schema_version": "1.0.0",
  "declaration_id": "project-identity-and-rights-v1",
  "status": "OWNER_APPROVED",
  "repository": "Eilodon/HSDL-Harmonization-Gap",
  "repository_owner_account": "Eilodon",
  "owner_approval": {
    "approved": true,
    "approved_by": "Bao Thai Ngo",
    "approved_at_utc": "2026-09-05T09:28:12Z",
    "approval_reference": "Owner declaration confirmed on 2026-09-05"
  },
  "license": {
    "spdx_identifier": "Apache-2.0",
    "copyright_holders": [
      "Bao Thai Ngo"
    ],
    "copyright_years": [
      2026
    ],
    "third_party_material_reviewed": true,
    "source_pdf_redistribution_scope": "NOT_RELICENSED; third-party legal texts, official documents/PDFs, quotations, and externally sourced materials remain subject to their original rights.",
    "allowed_owner_choices": [
      "Apache-2.0",
      "MIT",
      "BSD-3-Clause",
      "CC-BY-4.0",
      "CC-BY-SA-4.0",
      "PROPRIETARY_OR_CUSTOM"
    ],
    "notice": "Apache-2.0 applies to original code, documentation, models, and figures owned by Bao Thai Ngo. Third-party legal texts, official documents/PDFs, quotations, and externally sourced materials remain subject to their original rights and are not relicensed by this repository."
  },
  "citation": {
    "title": "HSDL Harmonization Gap",
    "version": "1.0.0",
    "release_date": "2026-09-05",
    "doi": null,
    "repository_url": "https://github.com/Eilodon/HSDL-Harmonization-Gap",
    "authors": [
      {
        "name": "Bao Thai Ngo",
        "given_names": "Bao Thai",
        "family_names": "Ngo",
        "orcid": "https://orcid.org/0009-0003-9693-4077",
        "affiliation": "Independent Researcher",
        "email": "bao.nt.1992@gmail.com",
        "roles": [
          "author",
          "maintainer"
        ]
      }
    ],
    "contributors": [],
    "preferred_citation_type": "software",
    "message": "If you use this software or research artifact, please cite it as below."
  },
  "publication": {
    "corresponding_author": "Bao Thai Ngo",
    "affiliations": [
      "Independent Researcher"
    ],
    "orcid_identifiers": [
      "https://orcid.org/0009-0003-9693-4077"
    ],
    "funding": [],
    "conflicts_of_interest": null
  },
  "generation_policy": {
    "license_file_allowed": true,
    "citation_cff_allowed": true,
    "release_metadata_allowed": true,
    "fail_closed_on_missing_owner_approval": true
  }
}
